{
  "chapter": 26,
  "title": "父亲终于开口",
  "summary": "林夏在第 26 天获得一条与梦境来源有关的新线索。",
  "wordCount": 4292,
  "characters": [
    "lin-xia",
    "chen-yan"
  ],
  "locations": [
    "school-library"
  ],
  "events": [
    "event-026"
  ],
  "arcUpdates": [
    "arc-dreamer",
    "arc-father",
    "arc-origin"
  ],
  "plotUpdates": [
    "plot-05"
  ],
  "foreshadowingUpdates": []
}
