{
  "chapter": 3,
  "title": "课桌下的纸条",
  "summary": "林夏在第 3 天获得一条与梦境来源有关的新线索。",
  "wordCount": 4000,
  "characters": [
    "lin-xia"
  ],
  "locations": [
    "lin-home"
  ],
  "events": [
    "event-003"
  ],
  "arcUpdates": [
    "arc-dreamer"
  ],
  "plotUpdates": [
    "plot-03"
  ],
  "foreshadowingUpdates": [
    "f-open-03"
  ]
}
