{
  "chapter": 15,
  "title": "父亲去过那里",
  "summary": "林夏在第 15 天获得一条与梦境来源有关的新线索。",
  "wordCount": 4000,
  "characters": [
    "lin-xia",
    "lin-father"
  ],
  "locations": [
    "lin-home"
  ],
  "events": [
    "event-015"
  ],
  "arcUpdates": [
    "arc-dreamer"
  ],
  "plotUpdates": [
    "plot-01"
  ],
  "foreshadowingUpdates": []
}
