{
  "chapter": 24,
  "title": "倒着生长的树",
  "summary": "林夏在第 24 天获得一条与梦境来源有关的新线索。",
  "wordCount": 4000,
  "characters": [
    "lin-xia",
    "lin-father"
  ],
  "locations": [
    "school-library"
  ],
  "events": [
    "event-024"
  ],
  "arcUpdates": [
    "arc-dreamer",
    "arc-father",
    "arc-origin"
  ],
  "plotUpdates": [
    "plot-03"
  ],
  "foreshadowingUpdates": []
}
