{
  "chapter": 27,
  "title": "玻璃里的陌生人",
  "summary": "林夏在玻璃后看见比自己年长的陌生面孔，父亲确认那不是普通倒影。",
  "wordCount": 4128,
  "characters": [
    "lin-xia",
    "lin-father"
  ],
  "locations": [
    "lin-home"
  ],
  "events": [
    "event-027"
  ],
  "arcUpdates": [
    "arc-dreamer",
    "arc-father",
    "arc-origin"
  ],
  "plotUpdates": [
    "plot-06"
  ],
  "foreshadowingUpdates": []
}
